timestamp,track,race,post_time,horse,program_num,jockey,trainer,surface,condition,distance,morning_line,live_odds,win_prob_pct,edge_vs_ml,edge_vs_live,bet_amount,alert_type,key_factors,result,payout
2026-03-28 14:32:14,TAM,5,02:37 PM,PORTFOLIO DURATION,6,Camacho Samy,Brown Chad C,Turf,Firm,8f,8-5,9-5,48.0,10.5,12.3,40,standard,"Sharp current form, figures trending up, sits a tactical trip.",WON (1st),56.00
2026-03-28 15:37:13,TAM,7,03:43 PM,GRAND LIAM,5,,,Turf,Firm,8f,5-2,3-1,40.8,12.0,15.8,40,standard,"Sharp current form, figures trending up, sits a tactical trip.",4th,0
2026-03-28 16:13:15,TAM,8,04:18 PM,WILLING ONE,3,,,Dirt,Fast,6f,7-2,6-1,26.2,3.6,11.9,35,standard,"Sharp current form, should control or press the pace, drifting from 7-2 to 6-1 on the tote.",WON (1st),126.00
2026-03-28 16:29:31,AQU,7,04:34 PM,LUCKY DUDE,3,,,Dirt,Fast,6f,5-2,3-1,40.7,0.0,15.7,40,standard,"TOTE SIGNAL: Sharp current form, figures trending up, sits a tactical trip.",3rd,0
2026-03-29 12:46:23,GP,1,12:50 PM,PLAYFUL PAL,5,VASQUEZ MIGUEL ANGEL,YATES MICHAEL,Turf,Firm,7.5f,10-1,10-1,20.3,7.2,11.2,30,standard,TOTE SIGNAL: Should control or press the pace.,3rd,0,https://github.com/levoniuslevon/horse-edge-tips/commit/0a39d58a356d1943b8af6eadf6cf756cf8f767a2
2026-03-29 14:28:05,TAM,5,02:30 PM,ADIOS COLE,3,ALVARADO JUNIOR,WILENSKY SAM,Turf,Firm,9f,9-2,8-1,21.7,2.7,10.6,30,standard,"TOTE SIGNAL: Drops in class to an easier spot, closing style fits if pace is contested, drifting from 9-2 to 8-1 on the tote.",2nd,0,https://github.com/levoniuslevon/horse-edge-tips/commit/bc3e7efb60bcbb24444675739f0abdeb272a63c2
2026-03-29 15:00:11,TAM,6,03:00 PM,ROCKIES BALBOA,4,ALVARADO JUNIOR,ROMANS DALE,Dirt,Fast,7f,8-5,2-1,53.9,-0.3,20.6,25,early,"TOTE SIGNAL: Drops in class to an easier spot, should control or press the pace, drifting from 8-5 to 2-1 on the tote.",2nd,0,https://github.com/levoniuslevon/horse-edge-tips/commit/9fbff03a10ce1e497d793c369bd5cd4283897145
2026-03-29 15:32:13,TAM,7,03:36 PM,CHICKEN DANCE,9,MARIN SAMUEL,ABREU FERNANDO,Turf,Firm,8.5f,9-2,8-1,23.3,4.5,12.2,35,standard,"TOTE SIGNAL: Sharp current form, closing style fits if pace is contested, drifting from 9-2 to 8-1 on the tote.",,,
