timestamp,track,race,post_time,horse,program_num,jockey,trainer,surface,condition,distance,morning_line,live_odds,win_prob_pct,edge_vs_ml,edge_vs_live,bet_amount,alert_type,key_factors,result,payout
2026-03-28 14:32:14,TAM,5,02:37 PM,PORTFOLIO DURATION,6,Camacho Samy,Brown Chad C,Turf,Firm,8f,8-5,9-5,48.0,10.5,12.3,40,standard,"Sharp current form, figures trending up, sits a tactical trip.",WON (1st),56.00
2026-03-28 15:37:13,TAM,7,03:43 PM,GRAND LIAM,5,,,Turf,Firm,8f,5-2,3-1,40.8,12.0,15.8,40,standard,"Sharp current form, figures trending up, sits a tactical trip.",4th,0
2026-03-28 16:13:15,TAM,8,04:18 PM,WILLING ONE,3,,,Dirt,Fast,6f,7-2,6-1,26.2,3.6,11.9,35,standard,"Sharp current form, should control or press the pace, drifting from 7-2 to 6-1 on the tote.",WON (1st),126.00
2026-03-28 16:29:31,AQU,7,04:34 PM,LUCKY DUDE,3,,,Dirt,Fast,6f,5-2,3-1,40.7,0.0,15.7,40,standard,"TOTE SIGNAL: Sharp current form, figures trending up, sits a tactical trip.",3rd,0
2026-03-29 17:42:21,TAM,11,05:40 PM,PARFOIS,11,ORTIZ IRAD JR,BROWN CHAD C,Turf,Firm,8f,2-1,2-1,44.2,1.5,10.9,40,standard,"TOTE SIGNAL: Fresh and dangerous off the layoff, sits a tactical trip.",,,
